{"SchemaVersion":"amd-chipset-publication-manifest/1.1","ToolkitVersion":"2.0.0","GeneratedAtUtc":"2026-08-12T06:12:44.2135918Z","PublicRootPolicy":"Only public/** is an automated generated-output commit surface.","PrivateDataPolicy":"private/evidence/**, inventory/**, reports/** and work/** are not automated generated-output commit surfaces.","TransformationPolicy":["Canonical per-release Raw JSON is copied byte-for-byte from runtime inventory/releases after field-scoped portable-path generation and compact serialization at canonical generation time.","Runtime-local installer identities in path-bearing canonical fields are represented as external-artifact/\u003cleaf\u003e when the value is the acquired installer path; the host directory is intentionally discarded before canonical per-release Raw JSON is written.","Extraction/workspace paths in path-bearing canonical fields are represented under work/extracted/\u003crelease\u003e/... or evidence/extraction-logs/...; vendor selector/MSI/XML token fields are never path-normalized.","Generated reports are deterministically normalized to UTF-8 no-BOM with LF line endings; selected CSV files are copied byte-for-byte from runtime staging. No report annotation is inserted during publication.","release-index.json, amd-selector-static.json, run-summary.json, run-report.md, publication-validation.json and this manifest are deterministically generated by the toolkit.","Tool-generated aggregate JSON indexes recursively canonicalize the Windows PowerShell 5.1 {value:[...],Count:n} collection-serialization wrapper to plain JSON arrays. Canonical per-release Raw JSON remains byte-unchanged.","Repository-relative paths in public indexes/manifests always use forward slashes; source SHA-256 is recorded for byte-copied and Markdown-normalized runtime artifacts.","Public JSON privacy checks parse JSON and inspect decoded scalar strings so Windows backslash escaping cannot hide runtime paths.","No generated public JSON/CSV/Markdown is intended to be hand-edited."],"FileCount":64,"ManifestEntryCount":64,"PublicFileCountIncludingManifest":65,"ManifestedPayloadSizeBytes":52858682,"LargestManifestedFileSizeBytes":2786457,"LargestManifestedFileRelativePath":"inventory/amd-chipset-windows-server-compatibility.csv","Files":[{"RelativePath":"inventory/acquisition.json","SizeBytes":19583,"Sha256":"983dfa1249cac403dbd63a44763539e8ff8a7063835cee754c9e3e697cffc6fd","Classification":"PublicRepositoryArtifact","GenerationMode":"ToolkitGenerated","SourceRelativePath":null,"SourceSha256":null,"HandEdited":false},{"RelativePath":"inventory/amd-chipset-driver-inventory.csv","SizeBytes":177375,"Sha256":"6b2aab4abd6521ea4f0699e1196f33aa1403254c1b5bdae4faa1beddaaa59ad0","Classification":"PublicRepositoryArtifact","GenerationMode":"ByteCopyFromRuntime","SourceRelativePath":"inventory/amd-chipset-driver-inventory.csv","SourceSha256":"6b2aab4abd6521ea4f0699e1196f33aa1403254c1b5bdae4faa1beddaaa59ad0","HandEdited":false},{"RelativePath":"inventory/amd-chipset-windows-server-compatibility.csv","SizeBytes":2786457,"Sha256":"118f52446e239de87184804b5d388529b3f4b4674c0226e78d40f6299ecde75d","Classification":"PublicRepositoryArtifact","GenerationMode":"ByteCopyFromRuntime","SourceRelativePath":"inventory/amd-chipset-windows-server-compatibility.csv","SourceSha256":"118f52446e239de87184804b5d388529b3f4b4674c0226e78d40f6299ecde75d","HandEdited":false},{"RelativePath":"inventory/amd-selector-static.json","SizeBytes":1613826,"Sha256":"20dd8b7bfc0dad7fd964ae54a280781250ee9c7194a4d9dd9d1bd5c9a7fe276e","Classification":"PublicRepositoryArtifact","GenerationMode":"ToolkitGenerated","SourceRelativePath":null,"SourceSha256":null,"HandEdited":false},{"RelativePath":"inventory/embedded-installer-metadata.json","SizeBytes":820355,"Sha256":"9e2dd4daf45b755d9772748a58e50265035393a4a4b151807d9d8238aa1e0037","Classification":"PublicRepositoryArtifact","GenerationMode":"ToolkitGenerated","SourceRelativePath":null,"SourceSha256":null,"HandEdited":false},{"RelativePath":"inventory/extraction.json","SizeBytes":393765,"Sha256":"084c3a44f19fdc1dc881b20b501d819d87e3458d7bc695bdb76d36c694d0f036","Classification":"PublicRepositoryArtifact","GenerationMode":"ToolkitGenerated","SourceRelativePath":null,"SourceSha256":null,"HandEdited":false},{"RelativePath":"inventory/release-index.json","SizeBytes":6756,"Sha256":"af88f5306626ef917dae0b5c621bb7f87e28df87517bd1056f29fa390dced7d3","Classification":"PublicRepositoryArtifact","GenerationMode":"ToolkitGenerated","SourceRelativePath":null,"SourceSha256":null,"HandEdited":false},{"RelativePath":"inventory/release-metadata.json","SizeBytes":18961,"Sha256":"ec46b1a5c227dacdecba2653ebb7a11da8262a5fd577f73b47a411b66137e83c","Classification":"PublicRepositoryArtifact","GenerationMode":"ToolkitGenerated","SourceRelativePath":null,"SourceSha256":null,"HandEdited":false},{"RelativePath":"inventory/releases.json","SizeBytes":8035,"Sha256":"8074f0bd12a24335c7a8db8e905c96892a8213d8023b8a2be1cf6f44f6b6a492","Classification":"PublicRepositoryArtifact","GenerationMode":"ToolkitGenerated","SourceRelativePath":null,"SourceSha256":null,"HandEdited":false},{"RelativePath":"inventory/releases/2.04.04.111/amd-chipset-analysis-2.04.04.111.json","SizeBytes":2499715,"Sha256":"b7dee7f9511a46bcbbf64914945273672f4db112cade749da6215184d4471b71","Classification":"PublicRepositoryArtifact","GenerationMode":"ByteCopyFromRuntimeCanonical","SourceRelativePath":"inventory/releases/2.04.04.111/amd-chipset-analysis-2.04.04.111.json","SourceSha256":"b7dee7f9511a46bcbbf64914945273672f4db112cade749da6215184d4471b71","HandEdited":false},{"RelativePath":"inventory/releases/3.08.17.735/amd-chipset-analysis-3.08.17.735.json","SizeBytes":1058858,"Sha256":"10171f833c42ac8729086923be6a9cd76140ce76df97168a38dadb668fe54ba2","Classification":"PublicRepositoryArtifact","GenerationMode":"ByteCopyFromRuntimeCanonical","SourceRelativePath":"inventory/releases/3.08.17.735/amd-chipset-analysis-3.08.17.735.json","SourceSha256":"10171f833c42ac8729086923be6a9cd76140ce76df97168a38dadb668fe54ba2","HandEdited":false},{"RelativePath":"inventory/releases/3.09.01.140/amd-chipset-analysis-3.09.01.140.json","SizeBytes":1058798,"Sha256":"46c68bac25049d87806126e82c30f3fc43d29e916d9173dc20977246cb6d862b","Classification":"PublicRepositoryArtifact","GenerationMode":"ByteCopyFromRuntimeCanonical","SourceRelativePath":"inventory/releases/3.09.01.140/amd-chipset-analysis-3.09.01.140.json","SourceSha256":"46c68bac25049d87806126e82c30f3fc43d29e916d9173dc20977246cb6d862b","HandEdited":false},{"RelativePath":"inventory/releases/3.10.08.506/amd-chipset-analysis-3.10.08.506.json","SizeBytes":1068704,"Sha256":"e079e26fbaec089225341fa2cc519c2e4abe05236619e0136b25677bc21b0b03","Classification":"PublicRepositoryArtifact","GenerationMode":"ByteCopyFromRuntimeCanonical","SourceRelativePath":"inventory/releases/3.10.08.506/amd-chipset-analysis-3.10.08.506.json","SourceSha256":"e079e26fbaec089225341fa2cc519c2e4abe05236619e0136b25677bc21b0b03","HandEdited":false},{"RelativePath":"inventory/releases/4.03.03.431/amd-chipset-analysis-4.03.03.431.json","SizeBytes":1103294,"Sha256":"5b8fb03b9c5e1ee297b903e624ed4e4ab985968857ed92c358dcff462c82455f","Classification":"PublicRepositoryArtifact","GenerationMode":"ByteCopyFromRuntimeCanonical","SourceRelativePath":"inventory/releases/4.03.03.431/amd-chipset-analysis-4.03.03.431.json","SourceSha256":"5b8fb03b9c5e1ee297b903e624ed4e4ab985968857ed92c358dcff462c82455f","HandEdited":false},{"RelativePath":"inventory/releases/4.06.10.651/amd-chipset-analysis-4.06.10.651.json","SizeBytes":1452232,"Sha256":"d5bea433d3ea3197123161af9bd20eabecbb272a91050d90f0d905983759c607","Classification":"PublicRepositoryArtifact","GenerationMode":"ByteCopyFromRuntimeCanonical","SourceRelativePath":"inventory/releases/4.06.10.651/amd-chipset-analysis-4.06.10.651.json","SourceSha256":"d5bea433d3ea3197123161af9bd20eabecbb272a91050d90f0d905983759c607","HandEdited":false},{"RelativePath":"inventory/releases/4.08.09.2337/amd-chipset-analysis-4.08.09.2337.json","SizeBytes":1455801,"Sha256":"c934dc5948867ab1fe2fac6ca7a097c931e272588d19cd5111a904dccddc1b20","Classification":"PublicRepositoryArtifact","GenerationMode":"ByteCopyFromRuntimeCanonical","SourceRelativePath":"inventory/releases/4.08.09.2337/amd-chipset-analysis-4.08.09.2337.json","SourceSha256":"c934dc5948867ab1fe2fac6ca7a097c931e272588d19cd5111a904dccddc1b20","HandEdited":false},{"RelativePath":"inventory/releases/4.09.23.507/amd-chipset-analysis-4.09.23.507.json","SizeBytes":1521044,"Sha256":"4f1dca19e9e7d03e05e08e604e80ccd08915348ce62af7c14bc31e2c136e48c0","Classification":"PublicRepositoryArtifact","GenerationMode":"ByteCopyFromRuntimeCanonical","SourceRelativePath":"inventory/releases/4.09.23.507/amd-chipset-analysis-4.09.23.507.json","SourceSha256":"4f1dca19e9e7d03e05e08e604e80ccd08915348ce62af7c14bc31e2c136e48c0","HandEdited":false},{"RelativePath":"inventory/releases/4.11.15.342/amd-chipset-analysis-4.11.15.342.json","SizeBytes":1545421,"Sha256":"8c70cadc29b05ad1cb0bfa3ddc4953b832004a4ff06f5ad3c266949a08587e65","Classification":"PublicRepositoryArtifact","GenerationMode":"ByteCopyFromRuntimeCanonical","SourceRelativePath":"inventory/releases/4.11.15.342/amd-chipset-analysis-4.11.15.342.json","SourceSha256":"8c70cadc29b05ad1cb0bfa3ddc4953b832004a4ff06f5ad3c266949a08587e65","HandEdited":false},{"RelativePath":"inventory/releases/5.02.19.2221/amd-chipset-analysis-5.02.19.2221.json","SizeBytes":1640615,"Sha256":"658dd3f6b5d68231f91e78f661bea91f7a601e65ff687449902884af9c35dac3","Classification":"PublicRepositoryArtifact","GenerationMode":"ByteCopyFromRuntimeCanonical","SourceRelativePath":"inventory/releases/5.02.19.2221/amd-chipset-analysis-5.02.19.2221.json","SourceSha256":"658dd3f6b5d68231f91e78f661bea91f7a601e65ff687449902884af9c35dac3","HandEdited":false},{"RelativePath":"inventory/releases/5.05.16.529/amd-chipset-analysis-5.05.16.529.json","SizeBytes":1734052,"Sha256":"79d53c163f741ffbf43da27479988b7b856